user_id,stars,text,date
NXnWmsyvBx8hjmCTFROt2Q,5,"Extremely excited that this location opened up, considering the one at the Tucson Mall had closed and I didn't know what I was going to do with myself (I've had a Red Robin craving since I realized the other location was closing). 

First, I enjoy the bottomless fries. It isn't a healthy option and we should all limit how many fries we consume. Yeah whatever, when I go, I'm excited that the fries just keep coming. There are steak fries, chips, garlic fries, sweet potato fries. Great set of option here. 

I appreciate that when I asked for well-done, my burger was indeed well-done. That was pretty good, considering a lot of places don't understand my desire for ""no pink."" I got the Whiskey River BBQ without mayo (public service announcement: mayo is gross) and loved it. Delicious! The buns are to die for. They really impressed me. 

Also at the table was a Prime Chophouse that looked appetizing. Glancing over the menu, there are several different burgers that I'd love to try. I mean... there is a Bonzai burger (Hawaiian theme?) and the Blue Cheese burger, both of which look like they're amazing (I saw a Blue burger at a nearby table and salivated a little). 

Great service, even though they'd just opened and the place was slammed. They have TVs for football if you're into that. I think it makes the place too loud, and it is hard to have a quiet (well...any) conversation. But if you're there for food and not an intimate date you'll enjoy the burgers.",9/12/2018 20:19
kkaWSsIDLsKzHOl1UpD2tg,4,"Before heading to Americas Center for the home & garden show we stopped by to try Porano.  Gerard Crafts fast food italian concept.  
    We really liked the idea and our bowls.  I got pasta with spicy tofu, chicken, chili oil, crispy garlic and hot honey... delish.  My wife had pasta with sunday sugo sauce, with chicken, tofu, crispy garlic and pecorino.  My daughter got butter noodles with parmesan.  We all enjoyed our lunch.  
    I loved the space.  The decor was cool and modern.  I wish we had one close to where we live.",3/12/2017 23:47
8V1S82FVuaZLRSaOm309HA,4,This place has some very authentic Vietnamese cuisine. None of the dishes were Americanized they stayed very true to their roots. The Pho and Bun Bo Hue was very delicious and the fresh rolls and fried spring rolls were outstanding. I recommend this place for very authentic Vietnamese dishes. They have a very extensive seafood menu which I will be trying next time.,11/8/2019 0:06
Ayej8i7eNcSPzmPtQxDNKw,5,"Wow! There is a reason that there's always a two hour wait here! I'll start out with a tip, if you want to get a table come here right when they open! Even then, there was a way. The food was phenomenal and the service was great! This is the best brunch place in New Orleans! Definitely recommend any visitors in town, or locals, come down and check this place out! I got the Fried Chicken Benny and an ice coffee, and started with fried green tomatoes... So good!",4/18/2021 1:52
pB5lQM3aE2txJsr2amW5sA,3,"This used to be my favorite place to grab takeout but it seems that there's less fresh ingredients than used to be used. I used to love their veggies and chicken but now very little by way of veggies and the chicken is not quality. To add to it, we wished to dine in, added a generous tip to receipt but wasn't asked and our food came in to go containers. Why would someone tip over 20% if they're doing carry out? I also can't stand everything is styrofoam, even for dine in.",12/5/2017 9:31
q_wVhULPqerYHmov0eXbww,4,"The food is a 5 and might be one of the tastiest breakfast places I have been to.  The service though was slow and the wait staff all switched off throughout our meal so it was weird and disconnected.  The food took a while. But this place is a MUST stop for breakfast/brunch 


The atmosphere in this place is new and hip.  They have some cushion seating along with wood chairs and padded chairs.  He look inside is new, yet authentic.  It's an excellent place to eat even though this location is somewhat strange in a strip mall. 

FOOD-- I got the chikichikichanga.  Somewhat of a breakfast burrito with chicken.  So good.  Sounds weird but just get it.  My fiancé got the pumpkin pancakes and those were a fluffy tasty circular masterpiece.  Get them.  Get them twice.",9/2/2017 23:04
ytb3v_o9EbKVOYVPW7F1Zg,1,"last Wednesday me and my family (8 people) went there, but it turns out that your place was closed. we checked on your website before hand that you were not close. please update your website! other customers may mistaken this too. it was hard to find parking and it was very cold outside. we went there at 7pm too.",1/11/2022 2:52
6C8Ne6yRu6TzBLbhfhdduw,3,"tl;dr despite its gorgeous location and well-executed set-up, expect a menu of overpriced and underwhelming cafe fare

This all-day cafe, run by Top Chef champion Nick Elmi, was one of the hottest openings of the year. The Landing Kitchen is built into the ground floor of the Bala Cynwyd Residence Inn, itself an homage to the Pencoyd Ironworks foundry. Industrial accents including exposed beams, garage-doors style windows, and converted metalwork highlight the atmosphere. The spacious patio hosts plenty of marble tables, complete with umbrellas and heat lamps to accommodate any weather. If you're lucky, you can grab a seat at one of the sophisticated lawn chairs, arranged around the large gas firepit. The riverside location offers uncharacteristically stunning snapshots of the Schuylkill (one-upped only by the views from the Pencoyd footbridge, only a stone's throw away). Order at the counter, then take a number to your table.

We arrived mid-morning for Sunday brunch to a moderately sized line. Despite the hordes of staff members, most seemed either distracted or clueless. The line nearly stretched out the door by the time we ordered.

My partner and I split The Ironworker and the Landing Breakfast Sandwich. Both sandos were moderately sized, and both would have immensely benefited from a more exciting bun. For the former, the richness of the pork roll and Cooper sharp pleasantly contrasted the sweet tomato spread; however, the potato roll felt flimsy. For the latter, the maple sausage / salsa verde combo sported a nice zing of flavor, but the shoe-like English muffin was dull and forgettable. The table also shared an order of BBQ Fries, which could not have a more misleading name -- they were limp steakhouse fries, unevenly seasoned and served with Heinz ketchup packets. The coffees ranged from standard to underwhelming; flavor shots in the iced coffees were decidedly flavorless, despite an associated upcharge.

The bill sat at nearly $20 a head (after tax and tip). While the sandwiches were a step above fast-food breakfast sandos, the premium on them feels borderline criminal. While the Landing Kitchen is worth a visit at least once to appreciate the scenery, don't hold your breath for a dining experience to match.",10/18/2021 16:17
jc8xUrNwZRgXMSLr_qzAcA,5,"FINALLY Nashville gets a real Korean BBQ place. Well, Brentwood but close enough...and I didn't actually try the BBQ yet but it looks legit. The tables with grills are on the right side of the restaurant. If you just want the regular menu, you sit to the left. I went for lunch and was in the mood for some soup. Korean soup (or jjigae) is the best soup you will ever have. I used to live in Korea and would eat it almost every day when the weather was cold. Or hot. Or the next morning after a rough night. Ok, so it's always good (wiping off drool and getting back to my review). Sitting in the booth, it was pointed out to me that the table had a call button. This is what every restaurant in Korea has. If you need something, press the button. It might seem rude but it's actually pretty convenient. The menu has a mix of Japanese and Korean items. I didn't pay much attention to the sushi and focused on the Korean dishes. I was excited to see some great ""appetizers"" like tteokboki and pajeon. I knew I couldn't eat these plus a soup for lunch but I really want to go back for dinner and get some tteokboki. I knew right away what I wanted. Yukgaejang is my favorite Korean food. It's a spicy broth with shredded beef, egg, bean sprouts, glass noodles, and bracken (? I think this is the translation in English). If you've never had this, order it. It's life changing. I have had this at other  Korean restaurants in America and it has been a bit oily or just way too spicy (which it's supposed to be so that's fine). However, this one was perfect. It was spicy enough without killing me, it wasn't oily, and it had just the right amount of all the ingredients. This is the best bowl of yukgaejang I have had since coming back from Korea. The ban chan were also delicious and plentiful. My favorite dish is the cucumbers with the gochujang. Since it was lunch, I just had a Coke, but they have great prices on beer. They also have soju if you want to drink like a true Korean. Overall, this place is pretty authentic and seems to have all of my Korean favorites. I will be able to come here and fulfill all of my Korean cravings!",10/16/2018 18:47
58-fWc8wcvuWS6d7f8J4Vg,4,Had some delivered for a get together and I mean...they're simply great! I don't have too much to add to that. My favorites are the mint chocolate chip and snickerdoodle (chocolate chip a close third). If you're in the mood for some cookies can't go wrong here! They are very sweet/heavy for me so I recommend having a tall glass of milk or water next to you!,7/2/2021 23:08
880oNqoWLYv7f_eo0Cgsmg,3,"Super busy breakfast joint. You might be waiting for quite a bit to get a table on weekends. But these are the types of breakfast places I do like to go to, I love the noise and the crowds, wakes me up on a lazy saturday. 

Good food and good service. My favorite is huveos ranchero with the green sauce. That's all I go here for. It is delicious. It's heavy and I always have some left overs.",12/21/2021 4:41
vdioUea83QYfcVpet3PELw,2,"Lots of employees walking around doing nothing. I watched the same guy walk a 30 foot stretch over and over picking up and setting down the same rag. There was no water refill at any point, lots of upset tables with issues with their checks. The young hostess was very friendly. Most of the employees wandering around seemed lost like they weren't sure what their job was. The rest of the staff was beyond slow and not super personable. It took  around 30 minutes to get our check. 

The food presentation was good but way overpriced. The ""smash burger"" is not a smash burger, thick patty more like a steak burger? It was good flavor but just not what the menu said by any stretch. Also didn't have the normal smash burger flavor of being cooked in mustard. 

The fries were a large portion as pictured good thing for an extra $4, heavily seasoned in Lawrys.",10/24/2021 20:45
7i5QqTqtT043RnL2dE4I4Q,4,"First time I went to Seattle I tried dim sum and fell In love, when I came back to Indy I looked for a place and I found that lucky lou is the only actual dim sum restaurant in Indiana so I tried it. 

The food is great and authentic, love the taste and the price for what you get buuuut the service is not really nice. I have always thought it might have to do with a cultural situation but today, after probably my 10th time of being there I can tell that my waitress was nos happy doing her job today. Hopefully next time it'll be different. 

The food is worth the experience with the waitresses.",5/15/2021 22:56
eu6qafxvSwlnfmHVcD8Qzg,4,"Great Date location!! This was our pick for Valentine's Day. We started off with the toasted ravioli which was delicious. The ravioli came with a marinara sauce that was unbelievable. We order drinks to start the night off right. I had their famous whiskey and cola..well I had a couple of them. This cocktail was made with a st Elmo whiskey which had hints of cherry in it. They were so good!!! Great dishes to try if you love seafood like I do is the scallops with couscous. My fiancé had the filet which was super tender. For sides we had fried green tomatoes, creamed spinach, and mash potatoes. Everything was great even the service. Our server Sarah was very attentive. The only thing that missed the mark was the bread pudding. It was really burnt at the bottom. All in all a great time with great service!!",2/15/2020 14:41
__lBqInsieAkCXmrPSMguA,3,"Come here early if you want to be able to pick from the entire menu! I think I would have had a much better experience if I'd been able to have my first or second choice meal. The Mug is farm to table, which means that their ingredients come in limited quantities so once they run out, they're out! Head over early to ensure that you can have your pick of everything they have to offer. 

I had the sloppy joe because they were completely out of chicken when I went. The meat was what you'd expect from a sloppy joe but the bun was just a general grocery store bun. I decided to go for the garlic fries, but found them to be a huge letdown. Instead of the fries being tossed with fresh garlic or granulated garlic and any other seasonings, they just added chopped garlic to the top of regular, non-seasoned fries. I've heard the sweet potato fries are good, so maybe go with those instead. We wanted to try their mac and cheese, but they were also out of that when we went. On the plus side, their root beer is delicious! Someone in my party said the pork tenderloin was very tasty, so go for it if you're interested.

They have a nice covered patio and allow pets to sit there while you eat, so that's a huge plus especially when the weather is nice. Overall, just make sure to head over early if you want to be able to choose from the entire menu!",9/29/2019 2:32
2T-uLnrd-PHwcEAQWqMsHA,5,"Amazing is an understatement. My husband and I were in New Orleans for 4 days and went on a mini food tour around the city. We ended up at Sylvain by miraculous chance on our last night there. I'm not even sure there are words to describe its awesomeness! The sweet breads were the most amazing we have ever had, the Brussel sprout salad IS as good as they say it is, and the antipasti is beyond phenomenal! My husband had the beef cheeks which literally melted in your mouth and had the most amazing flavor. I had the Flounder special served over a sweet potato and sausage hash set on top of pesto sauce. UNBELIEVABLE! My mouth is still watering! The staff is friendly and very welcoming, along with one of the owners who we had the pleasure of meeting.  You have got to go there and experience this lovely restaurant, your taste buds will thank you! We will definitely be returning and are recommending it to everyone we know! Thank you Sylvain for an amazing dining experience.",2/6/2013 14:48
gfQqQYI5_hCAGEHlHXIz2Q,4,"Really good selection. I was looking for a specific beer for a bread recipe, and since I was in NJ visiting family I called around to see where I could find it. (Stores near my Philly home didn't have it.)

This place said they had it, so I headed over. They also have a wide selection of local beer, so I picked up a new-to-me local brand to try. 

I got in and out quickly, and staff were quick to help me find what I came for.",1/3/2022 16:32
YuUws-XyGVMbkOLN8aF4WQ,4,"100% satisfied with my experience here for brunch. They have a great reasonably priced menu including bottomless mimosas for $15 and beer bloody Mary's for $6.50! Ample outdoor seating on the front patio for that perfect brunch feel. 

I ordered the bleu cheese burger which came with country potatoes, they were just a little dry so I might do salad next time. 
My friend ordered the cornbread Benedict, interesting mixture but I don't think I'd order it for myself. 
I'd love to come back for happy hour and appetizers and to sit out on the back patio.",11/12/2017 20:46
7o8LwMEYdRW6hYHWQGA_8w,2,"Beautiful gifts with many items geared towards St. Louis and regional teams/schools. I'm only giving them two stars because the prices are outrageously expensive. Go to Etsy and you will pay 1/3 as much for the same item.

As others have mentioned, their customer service is also terrible. It's clear that their staff only acknowledges some of their customers and completely ignores others. I have been there at least 5 times and not once have I ever been greeted. I would not recommend this store.",1/13/2022 0:38
bJ5FtCtZX3ZZacz2_2PJjA,5,"Such a cool little big bar! I am definitely glad that Marissa suggested it as the spot for the next Happy Hour Gathering. otherwise I probably would have continued to walk by it on my way to The Alley, Singing Fountain, Black N' Brew, and well you get the idea.

I loved the chill room that was able to encompass are entire crew, and not just because I got to relax in a sweet rocking chair. and this bar is definitely the real deal if you're a beer aficionado.Since I was on a budget this time around I wanted to keep my drink tab pretty reasonable. but that meant I was still able to enjoy Strawberry Wheats,  #9's, and my newest discovery the Vanilla Java Porter! It beat out Race Street Cafe for my pick for third best beer variety in Philly, and it doesn't involve the wait that the other spots had. Score!

I have to say that people had me scared over the food that this place offered. but I tried it anyway and definitely enjoyed it. One of the best grilled cheese sandwiches I ever had. and the fries were pure addiction! Spot on service too. I don't know how many tabs are server had to keep. But she definitely kept them all in order. I'll be back!",4/4/2008 4:33
tHVFAI0kemjV8Il9UjXBrw,4,"I go to Hung Vuong at least once a week for most Asian groceries. The prices just can't be beaten here. Seriously. Plus, Hung Vuong is a lot bigger than Hmart (the other nearby Asian grocery store), so they consistently carry the most exotic produce and imported shelf items in this area.

Although if you see something you like, stock up because there's no guarantee it will ever be back in stock again. This has happened to me with some of my favorite items in the past (a certain brand of Thai coconut milk and a brand of Filipino cookies).

However, you should be aware of one thing with Hung Vuong's low prices. Some produce could be on the verge of going bad or shelf items slightly past the expiration date. Not everything is like that, but sometimes there are many more than I would expect. So, inspect your fruits and check your dates on items you buy to be on the safe side.

TIP: Be sure to sign up for their rewards program, available at the customer service area. That way, you can get a few bucks off once you spend a certain amount.",1/10/2022 2:22
s6CB8sohXlCL6XZDgAy3SA,1,"I think Basic 4 was one of the most disappointing veg restaurant experiences I've ever had. I ordered the ""Carrot Tuna"", which a previous user raved about on another site, VegGuide.org. That user only had one review so I can't help but wonder if he/she is an employee/owner of Basic 4 and posted this false review to boost business.

I've had tofu, seitan, and chickpea-based ""tuna"" and they've all been good. Some use dulse/seaweed to give it a ""fishy"" taste, some use chopped celery to give it better texture, and all use some sort of vegan mayo. Basic 4's ""carrot tuna"" uses none and they don't add anything else to give it interesting flavor or texture. The sandwich was literally carrots on a pita. The pate appeared to be pure carrots pulverized in a food processor, with a little onion and maybe salt and lemon juice. How on earth is this supposed to resemble tuna? The plain carrot mixture was scooped into a pita bread with lettuce, onions, and tomatoes - no protein, and no mayo or sauce. It was the most boring sandwich I've ever had and a total waste of $6. I couldn't bring myself to finish it, so I took half of it home, added a veggie burger, some Veganaise and Siracha, and called it a day.

I also ordered the cream of broccoli soup for about $5, which turned out to be very bland. I'm glad they offered a vegan cream soup, as much of their menu isn't vegan (it looks like some of the soy meats they use contain milk), but it tasted like the stereotypical vegan soup that you would NOT want your non-vegan friends to taste. There was no robust flavor so instead of using rich vegetable broth, soy cream, and vegan butter, I think they just used water and thickened it with flour. No good.",12/10/2011 18:53
NAaivzPy-1wVLWp9h5BAYg,4,"New record store opened up in the Murphy building for local label Joyful Noise. They carry their own artists and I think some others as well. I definitely noticed something from Asthmatic Kitty. They had vinyl, cds and even cassettes. I'm not sure who's buying the cassettes, but maybe they're so lame they're cool again? The vinyl seems to all come with a code to download a digital copy, which is the best of both worlds. It's a tiny little location, but the staff was really friendly and hours are good. If you're not familiar with any of their artists check out Kishi Bashi. He's pretty awesome.",8/20/2013 16:54
hcTjjvDdRYMBSHVTnBuNIg,3,"Update! This place was recently remodeled and they are now a pho place. There's no bubble tea. I went in surprised but decided to try out the tofu banh mi they have on the new menu. I was pretty disappointed. The tofu was soggy and flavorless, the bread just wasn't right. I haven't tried the Pho but I've lost the desire to go back. 

The new space however is bright and clean and the employees are friendly.",3/23/2019 21:38
VYuuNzTWju8D0rr8SvaZjA,4,"This was a solid 4-star experience. From the energetic and friendly staff to the good food to the clean facilities - no complaints here. I know Halal Guys is a chain so I had a high level of confidence that the food would meet my expectations but you never really know. The food here was good. Just what I expected. 

What really made this location stand out was the service. The girl behind the counter seemed happy to be there and happy to provide suggestions and accommodate requests for extra white sauce and add-ins for both my platter and my boyfriend. There is nothing worse than an agitated server at a fast casual restaurant. 

We will certainly be back when we're in the area.",8/20/2018 18:24
wPjWQJVMt0fwm-EKg4Yacw,5,"Good food and prices, the pastries are good and made fresh daily. I stoped in one day for lunch wasn't disappointed.",1/15/2022 11:10
q_dQdEteWtAtlWjShAleTQ,5,"I feel like as a younger lady it's a little intimidating shopping at smoke shops in the area but this place is AMAZING compared to the rest! Stellar customer service every time I come in and they have great prices. I always feel welcomed in here and they answer all my questions and take my price range into consideration with their recommendations. I never got the two girls name that helped me out but my receipt says Jessi, they were both very helpful and kind. 

This smoke shop is a little bit of a drive from my house but it's definitely worth it. Will be coming here again for all my needs.",1/15/2022 18:35
LHWtjTG7e1NzNPYUbUo-9w,4,"Slice is an interesting phenomenon.  I have been to both the South Philly and the 17th and Sansom location's.  I enjoy the South Philly location a LITTLE more because each time I have been there - it's been way less crowded than the location on Sansom ever has been (Sansom location gets a LOT of traffic).  

The pizza at slice is really very good.  The crust is thin - the cheese is great - and there is NO grease.  I mean NONE.  Which I can seriously appreciate.  Additionally, they have a variety of cheese and dough options - which is great for people who are vegan, lactose intolerant, or are watching their weight.  The sauces taste good, and they always have an interesting combo of toppings / variety of pizza's that are great.  

The ambiance is simple, the service is good - the people are really friendly, but beware - they take only cash.  

The major DOWNSIDE of Slice is that it is a tad bit expensive. However, it's worth it.  

Next to Lorenzo's, and Franco Luigi's - I love Slice.  Great pizza.",5/31/2010 13:58
gJfMbl0xULJyHl2gJZEyVQ,4,"We went here for a Saturday night showing at 7:30. We were a bit late, but it was no problem getting seated quickly. We had 2nd row balcony seats and they were great. We saw Jimmy Wayne and Randy Travis. I think it'd be enjoyable even if there weren't any big names there, just to see the venue and hear some good music. Definitely try this at least once while in Nashville! Our show ended a bit late and when we left, we saw the huge lines of people waiting to get in - it made us happy we'd shown up late to our show so we didn't have to wait in the cold.",10/20/2010 2:14
rBeKFxV0PJ-wXMjaEa8G5A,4,"This is my regular Safeway that I visit since it is closest to my house.  It isn't the biggest Safeway but it much better than the other one I frequent -- the Whyte Ave and 109 St location.

This Safeway is big and bright in comparison and they have a great produce section and flower department when you walk in the entrance. The bakery and  fresh food counter is at the other side of the store and they each have a great selection of goods. There is a pharmacy at the back of the store as well.  In front of the checkout lines is a Starbucks if you are into that.

This Safeway is attached to Southgate Mall but I don't find that it greatly impacts the number of shoppers that use it.  It always seems busy but it is very seldom that there are big line-ups.  You can always use the self check-outs as well.",9/23/2015 7:18
_mx5GKPDGrSOkmUZJBZ2LQ,5,"Had an excellent latte and London fog here. The baristas were so nice. The coffee is the best I've had in Reno. The only bad thing is the basement is closed Mondays, so I couldn't get another coffee.",1/17/2022 18:34
