user_id,stars,text,date
vpH9_9kaZYyrUgBfwkgYow,5,Randomly ordered from here on a Thursday night because I was too lazy to cook. Idk how I found out about this place but saw it had good reviews and it did not disappoint. Exceeded all my expectations and desires. Literally the best Indian ever. So happy it's only an 8 min walk away. How have we not discovered lazeez yet.... This is dangerous. I'll be back soon lol. The chicken tikka masala medium spice level was perfect. Thank you to the employee who helped us gauge the spice level. Samosa was also very good but the chicken was to die for. Quick pickup service. Well packaged and came home hot. Perfect. Fair pricing too for the city. And the quality was just too notch. There's only one other place who makes their sauce this creamy and delicious and it's a place we found in Pittsburgh years ago. THANK YOU FOR FINALLY GIVING ME MY FAVE INDIAN SPOT at home here in philadlephia. I can't wait to order again.... COME HERE NOW and you better order the chicken tikka masala if you know what's good for you. That is all. Literally fire.,10/15/2021 0:39
VnryXWDQB1h1fVM_UiZqvQ,5,"This is a long time coming. I used to have list of places to eat in every city. This place has been on my list for 11 years now. And finally, I got to tick that off with an order of a scoop of  Hydrox Cookie Ice Cream. Ice cream are made for weekends. And it is a special treat specially on summer weekends. Have a cold delight to quench that summer heat at Franklin's!",8/1/2021 19:53
uICWNltwE0DVqL-u0NLjKw,1,"pd him over a thousand dollars to mount 2 wheels on my rigid chop. he told me a week, then encountered several problems, or so he says. he had my bike almost a month. when I got the bike back the spacing on the front wheel was incorrect. it's 3/8"" of center and the rockers are towed in causing the active fork to wear out faster.  I took it back a second time for him to fix it and he had my bike 4 days, didn't touch the incorrect spacing but replaced the bearings and charged me another 200 to put Chinese bearings in. when I confronted him about the incorrect spacing he told me the active fork was bent. but I'm not sure what that has to do with mounting a wheel in the center of a front end, with proper geometry. stay away from this business, no pride or integrity here.",12/9/2019 13:10
djxnI8Ux8ZYQJhiOQkrRhA,5,"Wow! Katie's, where have you been all my life? 

Actually, that's not completely true. I've eaten at Katie's before, but it was several years ago, right when they first opened up. I wasn't terribly impressed (back then my idea of ""good"" pizza was pepperoni and maybe olives) and didn't think to come back until just recently. 

Fast forward to Wednesday night. My gal pals and I just finished up a pedicure at Beautiful Nail and I used the handy Yelp iPhone app to find restaurants nearby. Katie's popped up and I remembered reading so many positive reviews about it, so why not give it another try?

I had completely forgotten how cute it is inside! The interior reminds me of someplace you'd visit that's not St. Louis... perhaps Chicago or LA. Some previous reviews mentioned bad service, but our waitress was awesome. She gave us plenty of time to pick out what we wanted to eat and even suggested a bottle of Chianti that would go well with our selection. 

Let me just say that their salads are to die for. Even if you're not a pizza lover, go here and order one of their many delicious leafy green options. One salad can easily be split between two people as an appetizer. We went for the beet salad, which had some of the best dressing I've had in a long time. 

For the main course, two of us split the roasted chicken pizza and my other friend had the four cheese pie. Both had a thin, crispy crust with fresh, hot ingredients on top. Hit the spot in so many ways! That was a lot of food for only three people, but we managed to eat almost everything served to us. 

I'm happy that Katie's was one of my last meals in STL - it was a perfect evening with my best friends. Glad that I have 'em another shot and that they blew it out of the park.",12/24/2010 16:14
vjZ9MA4n92Yixpv8--jmRw,5,"Antonio's has some of the sweetest staff. I came in for a quick dinner to go, but decided to stay because they were so nice.

The burritos are tops and the salsa super yummy!

You would be pleased to have found a good Mexican spot in downtown Reno. :D",4/7/2020 1:33
0xNiKvtvNelpiseFxTkVIg,2,"This should be a 2.5 star rating - okay pedicure, not great manicure. I'm disappointed because it was pretty expensive (easily $30 more than I'm used to paying in DC). The pedicure looks good - but the massage had zero pressure. More like a leg rub than a leg massage. 
The manicure is already chipped, there's a trail of bubbles on two nails and at least one nail still has ragged edges. 
The place was tranquil and my technician was nice but I expect more for an over $60 price tag. :(",10/14/2017 14:52
MdHKr5qVdaLPbz0ipejDTg,1,"I have had metro put an item on my credit report that I sent in clear documentation that it should not have been on there. The lady at the service they used has been nasty,hostile and not professional at all in handling the situation. I have emailed the documents to Patricia Boyer and she said it was sent to her supervisor and being taken care of. This has gone on for months and it is still on my credit report. This is the biggest scam I have ever seen. Beware of their contracts with consumers! I had documentation that my contract was resinded and years later I am still dealing with this! If I could have put 0 stars I would have.",8/15/2020 15:04
2uzH6U_kGVOBIIJoZOOUPw,4,"I'm in love with the BBQ sliders (brisket, pork and chicken). They're moist and juicy and I just want to stuff my face with them every day, for every meal.

The dry-rub wings are tasty, too. They're $5 bucks at happy hour, and though you only get about five or six wings, they're not too skimpy. Plus, they taste the way I always want my chicken on the grill to taste--crispy, almost a little burnt, with a nice charred flavor and tender on the inside. While I fail at cooking (er, grilling), Betty's does not.

The sauce (Sam's Famous BBQ) used on the BBQ combo platter (1/4 chicken and 1/4 ribs) is sweet and tangy and so wonderfully finger-lickin' good. I'm definitely a fan of having to lick my fingers a million times after each bite of messy BBQ. Wet wipes are available, of course, but who wants to waste any last drop of sauce, even if it means lick-lick-licking away?

The macaroni salad is decent and the mac and cheese is oozy with a little bit of breadcrumb crunch on top. Both are worthy of thumbs up. The stuffing with gravy is just okay ... there was a flavor in there I couldn't quite pick out and I probably wouldn't order it again. And the buttermilk biscuit was quite dry. It tasted like someone went overboard with the flour and forgot about the butter. But! The rest of the menu looks promising (lots of interesting sandwiches and plenty of other sides). Must try more!

I wasn't drinking yesterday (huh?!) but the beer/wine/cocktail menu was similar to that of Devil's Alley--plentiful enough for drinkers across the board. The Smokin' Betty's Blonde and house wines were being offered for $3 during happy hour. I'm sure I'll be hittin' that up next time.

Oh, and I loved dining upstairs by the windows. Actually, the whole space is quite swank but in a non-glitzy way. Dark wood and lots of light. I could see it being a great spot for an event. Plus, the service (both hostess and servers) was friendly and attentive. Let's see if that sticks.

Yay and more yay! I hope this place does well because I'm looking forward to getting my BBQ on a lot more often this summer. 

Dammit, I want a slider right now.",7/10/2009 15:48
b39y_inQloddW6I49gV5AA,3,"Fergie's is a fine spot for some beers and grub, but on the pricey side.

The beer selection is okay with about half a dozen draft beers and about a couple of dozen bottled beers, including a few impressive hard-to-find brews.

The food is fine. The chilis, both meat and veggie, used to be standouts, but then they changed the cornbread recipe, and the dish didn't have the same kick.  Maybe they're rectified that; chefs change here so you never know.

On Tuesday and Thursday nights there' s quizo here, which is great.  Except for the $10 a person minimum charge since not everyone always wants to drink booze or eat on quizo nights.

On some nights they have live bands perform upstairs.  The music tends to be amplified to deafening levels.  Earplugs are great if you have them.

Decor is dark-wood Irish bar, as you'd expect from a Fergus C. establishment (if you're lucky, you might even spot Fergie himself on premises sporting a grandly flowing white beard and a smile).",3/25/2014 19:19
1ixBOituybLrN_6rsRQCZA,3,"Came here for dinner with my bestie and her husband. Server was nice. They have my favorite krab and avocado salad. It's such a simple dish but I love it. My bestie ordered for us. She can be a food bully sometimes but she usually orders yummy things so I let her. I ordered the Salmon Roe but if you don't like fish eggs, this is not for you. We ordered a small hot sake that tasted kinda funny but we drank it anyway. The food was good, no complaints. I would return.",7/4/2018 20:51
HAF9JECDCzVJ8vdRYdj0ZA,1,"I have a 2011 Toyota Sienna Limited. During the winter the driver's side door stopped operating. I could see that the cable that was inside the door broke. I took the van to the Conicelli Toyota in Springfield, PA. I was presented with a $1500 estimate to replace the door motor and apparatus and I was charged $128 for the service of looking for the problem.  I decided to try and get another estimate as that seemed quite high. As a result of looking into the situation with other people I purchased the cable part directly from a parts company. A friend believed he could replace the part. Although I received the part in December it wasn't until recently that he was able to do the job due to the weather. As a result it was just the cable apparatus that was needed not the motor. The cable apparatus cost $36.63. I feel that Conicelli Toyota was either trying to rip me off big time or they didn't want to be bothered with a small job of replacing the cable apparatus. Either way it says nothing good about this Toyota service location. As a result I will never go back there. They were not the happiest service people and I'm hoping to find a service department in my area that I can rely on.",4/6/2021 19:28
I747RIfuvimyWPGbMuj9Sg,4,"I was exploring Philly with friends and we were hitting up a bunch of eateries. Trish suggested we go here because ice cream is awesome and this was a Philly staple that we should really visit. The decor is really cute and super retro and service was really friendly.

The three of us decided to split the Dr. Dovey's Classic Banana Split using non-dairy chocolate, non-dairy vanilla and banana ice cream. (They use a coconut base for the non-dairy ice creams!) It was glorious! Expensive, but glorious.

Be prepared for longgggg lines and make sure you bring cash with you!",4/1/2014 17:57
SwguNUaL--3Fu7fksgc1og,5,"You can get bike service at any shop. This shop has the vibe. That vibe will make you feel the feels. These guys want what's best for you and your bike. They also want a relationship between you, them, and your bike. In essence, you will get everything you walked in for in terms of service for your bike. You will also receive all those other tangible feelings that will make you comeback again and again. If by some unlucky miracle you do not get that feeling, you can order a great tasting latte to drown your bad attitude in.",1/16/2022 1:43
YXe2cna1J50Edp43sYKyQw,1,Complete disappointment.  I ordered munchkins and they were crumbled/crushed and wrong flavors. My chicken croissant sandwich was still frozen and pink looking in the middle. They were out of several types of donuts. I have zero desire to return to this location.,6/16/2019 15:58
YquuKjX350bZFAOV4NaRrw,4,"This is a great pizza place that is also one of the few that deliver into Trenton. We ordered a tomato pie and it was delicious, all of us loved the super thin crust and the copious amounts of marinara sauce (it was very slightly sweet which blended it great with the cheese, which was also not too heavy). I think we have definitely found our new go-to pizza place. Also, another plus is that they delivered very fast, well within the timeframe they said they would!",2/12/2017 17:49
zV99rzBLsU5KUWd6oJhc-w,5,"Love this place! Easy to get to. Laid back. Plenty of spaces to hang out. Great place to bring kids, dogs and friends. Wonderful for families.

Food is good. I recommend the bang bang cauliflower. Lots of beer and wine. What's unique is the kombucha and spiked kombucha drinks and mocktails . Great for folks who aren't drinking.

Great entertainment: wonderful bands, games and axe throwing is attached.

Wonderful place to hang out in a small town.",1/18/2020 5:35
EwY-4k2CKxc6Z8-W7SlIcg,1,"Last year I went into this dealership to purchase my first vehicle. I ended up buying a Jeep Cherokee and although I loved the car, I've regretted going to this dealership. I wish I had looked around more at the time and been more cautious because I without a doubt know I paid too much for it. A couple of days later, my sister decided to trade in her Jeep Wrangler, for another one. I liked our sales person, and everything seemed like it was going fine. 

We both purchased the extended warranty on our cars, and we've both had immense issues with customer service. We were both supposedly given free oil changes for 5 years when we purchased the cars, but when my sister went into get hers, she apparently didn't have the sheets for it. They said they couldn't do anything for her because it could've been the case that she had ""either never been given free oil changes or had sold them to make some money."" Absolutely ridiculous! They had no other way to pull up her information to see what was going on! I would think that a dealership of this size would have a better way of documenting these sorts of things to ensure that customers were covered should there be any sort of issue. She was denied the service, that she had been promised.

I figured that I would have better luck since I found the oil change sheets in a folder I had received when I purchased my car. However, I also had issues with their service! Every time I booked an appointment either to do an oil change or fix a flat tire, they needed something different! Every person I talked to told me something different. I needed the sheet for the oil change, then I needed all the sheets for oil changes I had. For the first flat tire I had I didn't need to provide any paperwork to demonstrate that I had purchased an extended warranty, but then the second time, they wanted to charge me, and refused to look up my information on the computer (which another representative had previously told me was possible)

This month, my car was stolen, and my insurance recommended I contact the dealership to receive some of the money that I had put towards this warranty, that I won't get to use, and I've been completely tossed around. I've tried to get in contact with multiple people, but have yet to hear back. 

My experience was so bad, that now that I am in the market for another vehicle, I am avoiding this dealership, and have decided to avoid Jeep all together! 

Overall, this dealership has some of the worst customer service I have ever come across. Avoid at all costs!",8/17/2015 18:36
u5o_QDwRPQW8gjgFudu9bg,5,"Man, I really lucked out with this trail.  I was on a group camping trip up the road at Lake Cachuma and had this trail scheduled.  They told us it was a 6 mile hike and about 30 minutes into the drive over there I was already ready to go home. lol.  I am not a hiker and it was really hot so I was nervous about being able to hang, and the fact that I was at the mercy of other people was making me sweat.  

Luckily, the swimming hole we found at the end of about a half mile of ""hiking"" was perfect and the group went swimming and after an hour or so they were ready to go back.  If I can make it out here again, I will try to hike the rest of the trail and find the other swimming holes.  

Be prepared for the $10 fee to get into the park.  There will be a person there to collect it and give you a tag.  This spot is not run by the forest service, so the person is not official looking. There are several river crossings you have to pass just to get to the trail head, which can be driven through in a sedan, but probably better if you have a bigger car.  It's about 5 miles in from the point you pay and it is seriously beautiful.  Be careful, look for other cars and don't get distracted by the view, but do enjoy it!  We stopped in a few places to take pictures because there was no one behind us. 

Highly recommend!!",6/6/2017 20:33
EZgTNWX5pz7ELXDScc4HOw,5,"My sister was visiting from NY so we decided to spend a couple hours in Tarpon Springs.  We stopped into Yianni's  for lunch and shared their pork gyro.  OMG, it was delicious!  The pork was tender, the wrap was homemade fresh and the dressing was great.  We sat outside and enjoyed the live music and people watching.  Staff was friendly and attentive.  This is definitely on my sister's list when she returns next December.  I'm looking forward to it as well!",3/2/2020 22:16
Fp5ORVnXCYAvIhmydRYekw,4,"Good option for takeout pizza in the area. Their sausage pie was very good, and their wings were pretty decent as well. I haven't dined inside just yet, but the restaurant itself looked cozy and casual. Would definitely recommend for a quick bite.",12/28/2021 17:40
6IeGk4i1BPl2PS5jWZ5OxA,5,"I am a sushiholic and this place knocked my socks off. This is place to be for innovative, new, special rolls. Deep fried spinach and beet flakes, mango, kiwi, coconut flakes - these are the kind of toppings you can expect. 

As a big group, we got many, many rolls. Every one was delicious and different. My favorite was the Mt. Lemon roll (I love lemon slices on sushi) and this one had no rice - just a big ol' bite of crab, lemon and other flavors. The Geisha lips and Golden Lobster were  also very flavorful. The Paris Roll was the most far-out for me, but I loved the variety of smoked salmon, kiwi and and spice. 

I also had a few bites of my sister's Tepan combo w/ filet mignon and lobster with chow mein type noodles - needless to say a very classy sort of fusion dish that was well cooked on both the surf and turf. 

The place is a very Vegas inspired sort of trendy with lots of playful buddhas, fancy modern lights and rich color scheme. As an added benefit Mr. An himself visited our table and he was a very charismatic sort that put the finishing touch on the visit.",2/12/2012 20:08
Vb3yGDoHB4QrdZfHzEf6ig,5,"Wow what a find!  Short review: All I can say is if you like food - get over to this place!

Long review: Tacos are probably my favorite food group and this place does not just serve yummy tacos, but they are beautiful tacos with flavors that you never expected to taste.  The pickled red onion with a hint of clove was delish.  The ever so subtle cinnamon hiding here and there was such a nice surprise.  My taste buds just wanted to get up and dance!

Piggy Stardust , perfect.  It was beautiful, tasty and the mango habanero sauce was a yummy option. 

I wanted to try more of their beautiful food,  but the tacos come in pairs (psst , how about letting us put two different tacos on a plate ? It would be a heavenly option) so I guess, I will just have to come back another day. 

The space is cozy,  hip and has great local artwork on the walls.  Bruce Maurey's portraits of some of my most beloved musicians hang downstairs and the mural that leads to the upstairs is the handiwork of Cody Rutty.  A live jazz band was being offered on a Monday evening!  Who does that ?  

This place is Boise through and through; casual setting with indoor and outdoor seating options to enjoy great food, art and music; all of it , first rate.  

Yeah, I pretty much love it.

Sixth Star Bonus awarded  for them:  they use compostable paper boxes for take out.  Thank you !",8/14/2018 1:48
YrlNGnrofZHseVYxrLrvJA,5,"Great, great record store. Whenever I come here I'm reminded of the amazing amount of music being created in New Orleans...they have it all. If you're visiting New Orleans and you want a CD to take home, but aren't sure what you want, this is the place to go. They have listening stations and the knowlegable staff will assist. I could spend hours here.",1/15/2012 20:15
TtuLyYy4Gf41XA2JUQgY8A,4,"First: do not judge me for getting fried chicken at 9:30 in the morning....

Okay let's begin: I got a half chicken (buttermilk ranch) and two sticky bun donuts to share  with my boyfriend. The half chicken was $9.25 and it was four pieces. I was hoping one would be a wing (it was not). there was one small breast, two thighs and a drumstick. I consider this price to be very very expensive. I don't like the fact that you can't just order pieces of chicken. It's in halves and wholes only. I understand the whole ""more sustainable, more humane"" thing of not ordering multiple wings, but I would be more inclined to come here a lot if it wasn't a $14 brunch. I got the half to share and honestly, I could have eaten three pieces because they were on the smaller end. 

But the donut was amazing and the chicken was really crispy and moist. The dry seasonings are like that weird popcorn flavor stuff( or the stuff they coat those chipstix at the beach). So if you don't like that, order it plain.",6/7/2014 1:52
WOyX1oiMVAc-MQ4Z-6MGXw,5,"I ordered using their online system. I accidentally put in the wrong address and they were super helpful in going back to the address they delivered the flowers to and taking it to the correct address. 

I saw the flowers a few days later and what a beautiful bouquet! Even better than the picture online! 

Extremely happy with the service and beautiful flowers.",7/25/2019 9:32
_3lMt9g1ScLZWGEqkv3LvQ,5,"I had stopped giving a 5 rating but have had to reconsider.  We were in town for our national meeting and finally we're given some free time.  Staying next door made this an obvious choice.  Ok, I have to admit, I am a great fan of country music.

Everyone that we ran into was so helpful.  That got us to our seats quickly, just before the show started.  Then the entertainment started, and all of them were awesome.  The blue grass band was so good that I decided I liked that kind of music.  The main act was Rascal Flatts, and although very good, I thought they came in last if I were rating.  Mo Pitney, who I had not heard of, was awesome.  I have already added some of his music.

We had great seats, right down on the floor by the stage.  All seats had a good view, and the sound system was good.

Will I return?  Already talking to the family about going during vacation!",5/7/2017 22:31
rixMfbhUpECMEK4rG2O_fg,4,"When hearing people rave and recommend this place I was so excited to get breakfast. The line moved rather quickly and when we finally sat we ordered coffee. One of the servers forgot my coffee. No big deal. When he came back he gave us one. We quickly ordered and it took a little bit more than normal. When I got our food I ordered the infamous egg couchon. My one egg was already broken.. Which was the severs fault when bringing it back (usually) kinda annoyed. The yolk was pretty dry by the time it got to me is all. However, I checked in and got the cheaper Bacon Bloody Mary. that was fabulous. Would I come here again? I'm not sure, but it was a great experience and I'm Glad we went once. Love the history behind the place. Oh yeah.. My sister got the cheesecake stuffed French toast! Super sweet but yum!",10/18/2016 0:26
jGW5lNFcw2z6PK0mzZ_C1w,1,"I'll start with that after they repaired the engine they didn't lock the oil cap back on so a couple days later the engine started smoking and there was oil all over the engine. West German BMW cleaned the engine and told us it was very dangerous. 
I called the manager at mainline and he just kept defending himself and asking me questions as if it was my fault we never opened the hood of the car since they had repaired it. Awful service terrible at taking responsibility I definitely do not recommend unless you wanna take a chance of your engine catching on fire.",6/30/2021 19:26
bCgB0aN-4vJWI4yVtVjlHA,3,"I have been here a few times in my life and I always enjoy receptions here.  The staff are always nice (duh, that is their job) and the view of the river is very nice.  I love hanging out on the patio.  Be sure to look at this place if you are going to have a party or reception.  The location is awesome and easy to get to as well",3/8/2013 0:48
